[
  {
    "slug": "seated-neck-side-bend",
    "name": "Seated Neck Side Bend",
    "type": "static",
    "targetMuscles": [
      "neck"
    ],
    "timing": "post-session",
    "holdSec": 30,
    "repeats": 2,
    "perSide": true,
    "requiredEquipment": [
      [
        "none"
      ]
    ],
    "howTo": "Sit tall. Drop one ear toward the shoulder. The opposite hand can rest on the head with no pull, just weight. Breathe. Switch. Do not crank.",
    "intensityGuidance": "A five-out-of-ten stretch. Tension, not pain.",
    "contraindications": [],
    "id": "db7afade-ed9e-5035-b555-dcbc49821e9c",
    "provenanceDefault": {
      "confidence": "moderate",
      "basis": "judgement",
      "source": "Coach & AI Programming Guide \u00a74.3 and stretching timing rule; this stretch is judgement",
      "reviewed": "2026-09-01"
    }
  },
  {
    "slug": "upper-trap-stretch",
    "name": "Upper Trap Stretch",
    "type": "static",
    "targetMuscles": [
      "trap_upper"
    ],
    "timing": "post-session",
    "holdSec": 30,
    "repeats": 2,
    "perSide": true,
    "requiredEquipment": [
      [
        "none"
      ]
    ],
    "howTo": "Sit on one hand. Tilt the head away and a little forward, as if looking into a shirt pocket. The sitting hand keeps that shoulder down. Switch.",
    "intensityGuidance": "A five-out-of-ten stretch. The shoulder stays heavy.",
    "contraindications": [],
    "id": "04b21705-2526-5176-a5ab-cbdf5d412aa7",
    "provenanceDefault": {
      "confidence": "moderate",
      "basis": "judgement",
      "source": "Coach & AI Programming Guide \u00a74.3 and stretching timing rule; this stretch is judgement",
      "reviewed": "2026-09-01"
    }
  },
  {
    "slug": "doorway-pec-stretch",
    "name": "Doorway Pec Stretch",
    "type": "static",
    "targetMuscles": [
      "chest_mid",
      "chest_upper"
    ],
    "timing": "post-session",
    "holdSec": 30,
    "repeats": 2,
    "perSide": true,
    "requiredEquipment": [
      [
        "door-frame",
        "none"
      ]
    ],
    "howTo": "Forearm on a door frame, elbow at about shoulder height. Step through until the chest opens. Ribs down. The neck stays long. Switch arms.",
    "intensityGuidance": "A five-out-of-ten stretch. Tension, not pain.",
    "contraindications": [
      "shoulder-impingement",
      "recent-shoulder-surgery"
    ],
    "id": "146d48a3-0724-5c06-9244-951112ce199a",
    "provenanceDefault": {
      "confidence": "moderate",
      "basis": "judgement",
      "source": "Coach & AI Programming Guide \u00a74.3 and stretching timing rule; this stretch is judgement",
      "reviewed": "2026-09-01"
    }
  },
  {
    "slug": "high-doorway-pec-stretch",
    "name": "High Doorway Pec Stretch",
    "type": "static",
    "targetMuscles": [
      "chest_upper"
    ],
    "timing": "post-session",
    "holdSec": 30,
    "repeats": 2,
    "perSide": true,
    "requiredEquipment": [
      [
        "door-frame"
      ]
    ],
    "howTo": "Same doorway, but the elbow sits higher than the shoulder. Step through a smaller amount. You should feel the upper chest more than the front of the shoulder.",
    "intensityGuidance": "A five-out-of-ten stretch. Back off a pinch in the shoulder.",
    "contraindications": [
      "shoulder-impingement",
      "recent-shoulder-surgery"
    ],
    "id": "4ac6561c-9b89-5375-8d73-1fd6722de9d4",
    "provenanceDefault": {
      "confidence": "moderate",
      "basis": "judgement",
      "source": "Coach & AI Programming Guide \u00a74.3 and stretching timing rule; this stretch is judgement",
      "reviewed": "2026-09-01"
    }
  },
  {
    "slug": "wall-biceps-stretch",
    "name": "Wall Biceps Stretch",
    "type": "static",
    "targetMuscles": [
      "biceps"
    ],
    "timing": "post-session",
    "holdSec": 30,
    "repeats": 2,
    "perSide": true,
    "requiredEquipment": [
      [
        "none"
      ]
    ],
    "howTo": "Stand side-on to a wall. Place the palm on the wall, fingers down, arm straight. Turn the chest away until the biceps lengthens. Keep the elbow soft, not locked.",
    "intensityGuidance": "A five-out-of-ten stretch. No elbow zap.",
    "contraindications": [
      "elbow-tendinopathy"
    ],
    "id": "023506aa-8c17-5dd6-b47a-2fe0654e9c8d",
    "provenanceDefault": {
      "confidence": "moderate",
      "basis": "judgement",
      "source": "Coach & AI Programming Guide \u00a74.3 and stretching timing rule; this stretch is judgement",
      "reviewed": "2026-09-01"
    }
  },
  {
    "slug": "overhead-triceps-stretch",
    "name": "Overhead Triceps Stretch",
    "type": "static",
    "targetMuscles": [
      "triceps"
    ],
    "timing": "post-session",
    "holdSec": 30,
    "repeats": 2,
    "perSide": true,
    "requiredEquipment": [
      [
        "none"
      ]
    ],
    "howTo": "Reach one arm overhead and bend the elbow so the hand finds the spine. The other hand can guide the elbow back, lightly. Ribs stay down. Switch.",
    "intensityGuidance": "A five-out-of-ten stretch. Do not yank the elbow.",
    "contraindications": [
      "shoulder-impingement"
    ],
    "id": "f82f0b39-b31e-5fd0-815f-8ca2c6a850a5",
    "provenanceDefault": {
      "confidence": "moderate",
      "basis": "judgement",
      "source": "Coach & AI Programming Guide \u00a74.3 and stretching timing rule; this stretch is judgement",
      "reviewed": "2026-09-01"
    }
  },
  {
    "slug": "wrist-flexor-stretch",
    "name": "Wrist Flexor Stretch",
    "type": "static",
    "targetMuscles": [
      "forearm"
    ],
    "timing": "post-session",
    "holdSec": 20,
    "repeats": 2,
    "perSide": true,
    "requiredEquipment": [
      [
        "none"
      ]
    ],
    "howTo": "Arm straight, palm up. Use the other hand to ease the palm toward the floor so the fingers point down. You should feel the inner forearm. Switch.",
    "intensityGuidance": "A five-out-of-ten stretch. Ease off a nerve tingle.",
    "contraindications": [
      "wrist-pain",
      "elbow-tendinopathy"
    ],
    "id": "41dbc885-e4f7-52ec-a2f1-122e80e1a25a",
    "provenanceDefault": {
      "confidence": "moderate",
      "basis": "judgement",
      "source": "Coach & AI Programming Guide \u00a74.3 and stretching timing rule; this stretch is judgement",
      "reviewed": "2026-09-01"
    }
  },
  {
    "slug": "wrist-extensor-stretch",
    "name": "Wrist Extensor Stretch",
    "type": "static",
    "targetMuscles": [
      "forearm"
    ],
    "timing": "post-session",
    "holdSec": 20,
    "repeats": 2,
    "perSide": true,
    "requiredEquipment": [
      [
        "none"
      ]
    ],
    "howTo": "Arm straight, palm down. Ease the back of the hand toward you so the fingers point down. Outer forearm should speak. Switch.",
    "intensityGuidance": "A five-out-of-ten stretch. No burning at the elbow.",
    "contraindications": [
      "wrist-pain",
      "elbow-tendinopathy"
    ],
    "id": "8c24af39-5fba-53a3-b764-e5d7f440b0d6",
    "provenanceDefault": {
      "confidence": "moderate",
      "basis": "judgement",
      "source": "Coach & AI Programming Guide \u00a74.3 and stretching timing rule; this stretch is judgement",
      "reviewed": "2026-09-01"
    }
  },
  {
    "slug": "standing-side-bend",
    "name": "Standing Side Bend",
    "type": "static",
    "targetMuscles": [
      "oblique"
    ],
    "timing": "post-session",
    "holdSec": 30,
    "repeats": 2,
    "perSide": true,
    "requiredEquipment": [
      [
        "none"
      ]
    ],
    "howTo": "Feet under the hips. Reach one arm up and lean away. Both sit bones stay heavy. Breathe into the long side. Do not twist to fake range.",
    "intensityGuidance": "A five-out-of-ten stretch. Length, not a crunch.",
    "contraindications": [],
    "id": "b7ce2856-1cb4-5ced-bcc4-f75253b979e2",
    "provenanceDefault": {
      "confidence": "moderate",
      "basis": "judgement",
      "source": "Coach & AI Programming Guide \u00a74.3 and stretching timing rule; this stretch is judgement",
      "reviewed": "2026-09-01"
    }
  },
  {
    "slug": "childs-pose-lat",
    "name": "Child's Pose Lat Stretch",
    "type": "static",
    "targetMuscles": [
      "lat"
    ],
    "timing": "post-session",
    "holdSec": 30,
    "repeats": 2,
    "perSide": true,
    "requiredEquipment": [
      [
        "none"
      ]
    ],
    "howTo": "Kneel and sit the hips toward the heels. Walk both hands forward, then walk them to one side so that side of the back lengthens. Breathe into the ribs. Switch.",
    "intensityGuidance": "A five-out-of-ten stretch. Soft neck.",
    "contraindications": [
      "flexion-intolerant-back"
    ],
    "id": "e02faf7b-24de-5d6f-83df-1e6ef3398a22",
    "provenanceDefault": {
      "confidence": "moderate",
      "basis": "judgement",
      "source": "Coach & AI Programming Guide \u00a74.3 and stretching timing rule; this stretch is judgement",
      "reviewed": "2026-09-01"
    }
  },
  {
    "slug": "hanging-lat-stretch",
    "name": "Hanging Lat Stretch",
    "type": "static",
    "targetMuscles": [
      "lat"
    ],
    "timing": "post-session",
    "holdSec": 20,
    "repeats": 2,
    "perSide": false,
    "requiredEquipment": [
      [
        "pull-up-bar"
      ]
    ],
    "howTo": "Hang from a bar with both hands. Let the shoulder blades rise toward the ears. Feet can stay on a box. Breathe. Come down before the grip fails.",
    "intensityGuidance": "A five-out-of-ten stretch. This is a hang, not a pull-up.",
    "contraindications": [
      "shoulder-impingement",
      "recent-shoulder-surgery"
    ],
    "id": "ea662e30-6e1d-509f-afdd-dc2f64c3dbbd",
    "provenanceDefault": {